{"bytes":36,"complete":true,"coverage_claim":"adapter-table-collection-one-source-snapshot","kind":"postgresql-table-collection-export","postgres_collection_summary_version":2,"receipt_sha256":"a4ef19a7099c78723b18a2246486496c572c1aac4d5f4e322cde4cf372fc675d","representation_bytes":4719,"rows":2,"tables":2}
