{"bytes":36,"complete":true,"coverage_claim":"adapter-table-collection-one-source-snapshot","kind":"postgresql-table-collection-export","postgres_collection_summary_version":2,"receipt_sha256":"94ea9a8237e2badf37126e8ff026c558f41fb1c0843aea1e7c22c1919043ba7e","representation_bytes":4617,"rows":2,"tables":2}
